职位,公司,工作地点,薪资,发布时间
Python高级开发工程师,北京棣南新宇科技有限公司,北京-海淀区,1.5-2万/月,07-10
python工程师,国和瑞斯（北京）科技有限公司,北京-海淀区,1-1.5万/月,07-10
Python后端开发工程师,中经网数据有限公司,北京-西城区,1-3万/月,07-10
python爬虫师工程师,北京丰源星际传媒科技有限公司,北京-西城区,1-1.5万/月,07-10
Python开发工程师(可视化),艾瑞咨询集团,北京,1.5-3万/月,07-10
Python人工智能实习生,寰宇优才教育科技（北京）有限公司,北京-朝阳区,0.8-1万/月,07-10
Python开发工程师,北京斯普信信息技术有限公司,北京,1-1.5万/月,07-10
Python讲师,北京智联友道科技有限公司,北京-海淀区,1.5-2万/月,07-10
Python开发工程师,北京汉能光伏投资有限公司,北京,2-2.5万/月,07-10
Python开发工程师,奔讯电子科技（北京）有限公司,北京-朝阳区,0.8-1.5万/月,07-10
算法工程师-C++/Python,北京智加智行科技有限公司,北京-海淀区,2.5-4万/月,07-10
云方向业务部门_Python开发工程师,北京思特奇信息技术股份有限公司,北京-海淀区,1-1.5万/月,07-10
Python后台开发工程师,北京星天下文化传播有限公司,北京-朝阳区,1.5-2万/月,07-10
python web 开发工程师,中国电子科技集团公司第十五研究所（华北计算技术研究所）,北京-海淀区,0.8-1万/月,07-10
Python开发工程师(面向2018届毕业生),江森自控（中国）投资有限公司,北京,0.8-1万/月,07-10
后端架构师（Python/Go）,御见思惟（北京）信息科技有限公司,北京-朝阳区,1.5-2万/月,07-10
python开发,北京知了点点教育科技有限公司,北京-海淀区,1.5-2.3万/月,07-10
python爬虫工程师,银谷普惠信息咨询（北京）有限公司,北京-朝阳区,1-2万/月,07-10
python开发工程师,国广东方网络（北京）有限公司,北京-海淀区,1-1.5万/月,07-10
python编程老师,上海傲梦网络科技有限公司,异地招聘,0.8-1万/月,07-10
Python高级研发工程师,北京好巧国际旅行社有限公司,北京,3-5万/月,07-10
python 研发工程师,长安通信科技有限责任公司,北京-朝阳区,1-1.5万/月,07-10
Python爬虫工程师,广州小鹏汽车科技有限公司,北京-海淀区,2-3万/月,07-10
Python开发工程师,广州市通证科技有限公司,北京-朝阳区,1-1.5万/月,07-10
Python开发工程师,北京娜迦信息科技发展有限公司,北京-海淀区,1.5-2万/月,07-10
python开发工程师（机器学习）,博彦科技股份有限公司,北京-海淀区,1.2-1.5万/月,07-10
Python讲师,北京书和翰林教育科技有限公司,北京-延庆区,0.8-2万/月,07-10
Python开发工程师,广州珠江装修工程有限公司（北京）,北京-朝阳区,1-1.8万/月,07-10
Python/Go开发工程师-北京-00395,北京比特大陆科技有限公司,北京-海淀区,1-2.5万/月,07-10
算法工程师（Java/Scala/Python/R方向）,北京中能博泰科技有限公司,北京-海淀区,1.5-3万/月,07-10
python开发工程师,北京天行网安信息技术有限责任公司,北京-海淀区,1-1.5万/月,07-10
python高级研发工程师,北京达美盛软件股份有限公司,北京-海淀区,1.5-2万/月,07-10
Python开发工程师,北京智慧星光信息技术有限公司,北京-海淀区,1-1.5万/月,07-10
python后端开发工程师,拓天伟业（北京）金融信息服务有限公司,北京-丰台区,1.5-2万/月,07-10
Python开发工程师,北京联龙博通电子商务技术有限公司,北京-丰台区,1-1.5万/月,07-10
C/C++/python研发工程师,北京东方网信科技股份有限公司,北京,1-2万/月,07-10
Python开发工程师,中科博宏（北京）科技有限公司,北京-朝阳区,1.5-3万/月,07-10
python高级开发工程师,北京博学慎思教育科技有限公司,北京-昌平区,2-4万/月,07-10
Python开发工程师,北京量子金服网络科技有限公司,北京-朝阳区,1-1.5万/月,07-10
Python开发工程师,北大医疗信息技术有限公司,北京-海淀区,0.7-1.4万/月,07-10
Python开发工程师,北京天融信科技有限公司,北京,1-1.5万/月,07-10
java开发（会Python优先）,华信永益（北京）信息技术有限公司,北京-海淀区,1-1.5万/月,07-10
Python开发工程师-base北京,游族网络,北京-东城区,1.2-1.8万/月,07-10
直聘软件开发Golang /Python,某外资上市人力资源公司,北京-朝阳区,1.5-2万/月,07-10
Python开发工程师,上海酷萌网络科技有限公司,北京,1-1.5万/月,07-10
Python  就业指导(J10734),传智播客教育集团顺义校区,北京-顺义区,0.8-1万/月,07-10
Python就业指导老师(J10736),北京传智播客教育科技有限公司,北京-顺义区,1-1.5万/月,07-10
python助教,传智播客教育集团修正分校,北京-昌平区,10-15万/年,07-10
Python开发工程师,普天信息技术有限公司,北京,0.8-1.5万/月,07-10
Python工程师,北京慕华信息科技有限公司,北京,1.5-3万/月,07-10
